{
  "$schema": "https://json-schema.org/draft/2020-12/schema",
  "$id": "https://istqb-prep/schemas/questions-index.schema.json",
  "title": "Lightweight index for questions (no question text)",
  "description": "data/<cert>/questions/index.json. docs/04-data-model.md §3.6. CI check #8 compares this file against the chunk files.",
  "type": "object",
  "required": ["dataVersion", "count", "chunks", "questions"],
  "additionalProperties": false,
  "properties": {
    "dataVersion": { "type": "string" },
    "count": { "type": "integer", "minimum": 0 },
    "chunks": {
      "type": "array",
      "items": { "type": "string", "pattern": "^ch[0-9]{2}-[a-z]$" }
    },
    "questions": {
      "type": "array",
      "items": {
        "type": "object",
        "required": [
          "id", "revision", "chunk", "chapter", "objectives", "kLevel", "type",
          "selectCount", "languages", "syllabusVersion", "status"
        ],
        "additionalProperties": false,
        "properties": {
          "id": { "type": "string", "pattern": "^[a-z0-9]+-[0-9]{4}$" },
          "revision": {
            "type": "integer",
            "minimum": 1,
            "description": "The question's own revision. A repetition card scheduled against an older one goes back to relearning (F3-11)."
          },
          "chunk": { "type": "string", "pattern": "^ch[0-9]{2}-[a-z]$" },
          "chapter": { "type": "integer", "minimum": 1 },
          "section": { "type": "string" },
          "objectives": {
            "type": "array",
            "minItems": 1,
            "items": { "type": "string", "pattern": "^(FL|AI)-[0-9]+\\.[0-9]+\\.[0-9]+$" }
          },
          "kLevel": { "enum": ["K1", "K2", "K3"] },
          "type": { "enum": ["single", "multi"] },
          "selectCount": { "type": "integer", "minimum": 1, "maximum": 3 },
          "difficulty": { "type": "integer", "minimum": 1, "maximum": 3 },
          "hasMedia": { "type": "boolean" },
          "tags": { "type": "array", "items": { "type": "string" } },
          "languages": {
            "type": "array",
            "minItems": 1,
            "items": { "enum": ["tr", "en"] }
          },
          "syllabusVersion": { "type": "string" },
          "status": { "enum": ["draft", "review", "published", "retired"] }
        }
      }
    }
  }
}
