{
  "dataVersion": "355103adf018",
  "count": 305,
  "chunks": [
    "ch01-a",
    "ch01-b",
    "ch01-c",
    "ch02-a",
    "ch02-b",
    "ch02-c",
    "ch03-a",
    "ch03-b",
    "ch03-c",
    "ch04-a",
    "ch04-b",
    "ch04-c",
    "ch05-a",
    "ch05-b",
    "ch05-c",
    "ch06-a",
    "ch06-b"
  ],
  "questions": [
    {
      "id": "ctfl4-0001",
      "revision": 2,
      "chunk": "ch01-a",
      "chapter": 1,
      "section": "1.3",
      "objectives": [
        "FL-1.3.1"
      ],
      "kLevel": "K2",
      "type": "single",
      "selectCount": 1,
      "difficulty": 2,
      "hasMedia": false,
      "tags": [
        "seven-principles",
        "tests-wear-out"
      ],
      "languages": [
        "en",
        "tr"
      ],
      "syllabusVersion": "4.0.1",
      "status": "published"
    },
    {
      "id": "ctfl4-0002",
      "revision": 2,
      "chunk": "ch01-a",
      "chapter": 1,
      "section": "1.1",
      "objectives": [
        "FL-1.1.1"
      ],
      "kLevel": "K1",
      "type": "single",
      "selectCount": 1,
      "difficulty": 1,
      "hasMedia": false,
      "tags": [
        "test-objectives"
      ],
      "languages": [
        "en",
        "tr"
      ],
      "syllabusVersion": "4.0.1",
      "status": "published"
    },
    {
      "id": "ctfl4-0003",
      "revision": 2,
      "chunk": "ch01-a",
      "chapter": 1,
      "section": "1.1",
      "objectives": [
        "FL-1.1.1"
      ],
      "kLevel": "K1",
      "type": "single",
      "selectCount": 1,
      "difficulty": 2,
      "hasMedia": false,
      "tags": [
        "test-objectives",
        "stakeholders"
      ],
      "languages": [
        "en",
        "tr"
      ],
      "syllabusVersion": "4.0.1",
      "status": "published"
    },
    {
      "id": "ctfl4-0004",
      "revision": 1,
      "chunk": "ch01-a",
      "chapter": 1,
      "section": "1.1",
      "objectives": [
        "FL-1.1.2"
      ],
      "kLevel": "K2",
      "type": "single",
      "selectCount": 1,
      "difficulty": 2,
      "hasMedia": false,
      "tags": [
        "debugging"
      ],
      "languages": [
        "en",
        "tr"
      ],
      "syllabusVersion": "4.0.1",
      "status": "published"
    },
    {
      "id": "ctfl4-0005",
      "revision": 2,
      "chunk": "ch01-a",
      "chapter": 1,
      "section": "1.1",
      "objectives": [
        "FL-1.1.2"
      ],
      "kLevel": "K2",
      "type": "single",
      "selectCount": 1,
      "difficulty": 3,
      "hasMedia": false,
      "tags": [
        "debugging",
        "static-testing"
      ],
      "languages": [
        "en",
        "tr"
      ],
      "syllabusVersion": "4.0.1",
      "status": "published"
    },
    {
      "id": "ctfl4-0006",
      "revision": 2,
      "chunk": "ch01-a",
      "chapter": 1,
      "section": "1.2",
      "objectives": [
        "FL-1.2.1"
      ],
      "kLevel": "K2",
      "type": "single",
      "selectCount": 1,
      "difficulty": 2,
      "hasMedia": false,
      "tags": [
        "testing-contribution",
        "user-representation"
      ],
      "languages": [
        "en",
        "tr"
      ],
      "syllabusVersion": "4.0.1",
      "status": "published"
    },
    {
      "id": "ctfl4-0007",
      "revision": 2,
      "chunk": "ch01-a",
      "chapter": 1,
      "section": "1.2",
      "objectives": [
        "FL-1.2.1"
      ],
      "kLevel": "K2",
      "type": "single",
      "selectCount": 1,
      "difficulty": 2,
      "hasMedia": false,
      "tags": [
        "testing-contribution",
        "release-decision"
      ],
      "languages": [
        "en",
        "tr"
      ],
      "syllabusVersion": "4.0.1",
      "status": "published"
    },
    {
      "id": "ctfl4-0008",
      "revision": 1,
      "chunk": "ch01-a",
      "chapter": 1,
      "section": "1.2",
      "objectives": [
        "FL-1.2.2"
      ],
      "kLevel": "K1",
      "type": "single",
      "selectCount": 1,
      "difficulty": 1,
      "hasMedia": false,
      "tags": [
        "quality-assurance",
        "quality-control"
      ],
      "languages": [
        "en",
        "tr"
      ],
      "syllabusVersion": "4.0.1",
      "status": "published"
    },
    {
      "id": "ctfl4-0009",
      "revision": 2,
      "chunk": "ch01-a",
      "chapter": 1,
      "section": "1.2",
      "objectives": [
        "FL-1.2.2"
      ],
      "kLevel": "K1",
      "type": "single",
      "selectCount": 1,
      "difficulty": 2,
      "hasMedia": false,
      "tags": [
        "quality-control"
      ],
      "languages": [
        "en",
        "tr"
      ],
      "syllabusVersion": "4.0.1",
      "status": "published"
    },
    {
      "id": "ctfl4-0010",
      "revision": 1,
      "chunk": "ch01-a",
      "chapter": 1,
      "section": "1.2",
      "objectives": [
        "FL-1.2.3"
      ],
      "kLevel": "K2",
      "type": "single",
      "selectCount": 1,
      "difficulty": 1,
      "hasMedia": false,
      "tags": [
        "error-defect-failure",
        "terminology"
      ],
      "languages": [
        "en",
        "tr"
      ],
      "syllabusVersion": "4.0.1",
      "status": "published"
    },
    {
      "id": "ctfl4-0011",
      "revision": 2,
      "chunk": "ch01-a",
      "chapter": 1,
      "section": "1.2",
      "objectives": [
        "FL-1.2.3"
      ],
      "kLevel": "K2",
      "type": "single",
      "selectCount": 1,
      "difficulty": 3,
      "hasMedia": false,
      "tags": [
        "error-defect-failure",
        "root-cause"
      ],
      "languages": [
        "en",
        "tr"
      ],
      "syllabusVersion": "4.0.1",
      "status": "published"
    },
    {
      "id": "ctfl4-0012",
      "revision": 2,
      "chunk": "ch01-a",
      "chapter": 1,
      "section": "1.2",
      "objectives": [
        "FL-1.2.3"
      ],
      "kLevel": "K2",
      "type": "multi",
      "selectCount": 2,
      "difficulty": 3,
      "hasMedia": false,
      "tags": [
        "error-defect-failure",
        "root-cause",
        "multi"
      ],
      "languages": [
        "en",
        "tr"
      ],
      "syllabusVersion": "4.0.1",
      "status": "published"
    },
    {
      "id": "ctfl4-0013",
      "revision": 1,
      "chunk": "ch01-a",
      "chapter": 1,
      "section": "1.3",
      "objectives": [
        "FL-1.3.1"
      ],
      "kLevel": "K2",
      "type": "single",
      "selectCount": 1,
      "difficulty": 2,
      "hasMedia": false,
      "tags": [
        "seven-principles",
        "defects-cluster"
      ],
      "languages": [
        "en",
        "tr"
      ],
      "syllabusVersion": "4.0.1",
      "status": "published"
    },
    {
      "id": "ctfl4-0014",
      "revision": 2,
      "chunk": "ch01-a",
      "chapter": 1,
      "section": "1.3",
      "objectives": [
        "FL-1.3.1"
      ],
      "kLevel": "K2",
      "type": "single",
      "selectCount": 1,
      "difficulty": 3,
      "hasMedia": false,
      "tags": [
        "seven-principles",
        "absence-of-defects-fallacy",
        "validation"
      ],
      "languages": [
        "en",
        "tr"
      ],
      "syllabusVersion": "4.0.1",
      "status": "published"
    },
    {
      "id": "ctfl4-0015",
      "revision": 2,
      "chunk": "ch01-a",
      "chapter": 1,
      "section": "1.3",
      "objectives": [
        "FL-1.3.1"
      ],
      "kLevel": "K2",
      "type": "single",
      "selectCount": 1,
      "difficulty": 2,
      "hasMedia": false,
      "tags": [
        "seven-principles",
        "early-testing"
      ],
      "languages": [
        "en",
        "tr"
      ],
      "syllabusVersion": "4.0.1",
      "status": "published"
    },
    {
      "id": "ctfl4-0016",
      "revision": 1,
      "chunk": "ch01-a",
      "chapter": 1,
      "section": "1.4",
      "objectives": [
        "FL-1.4.1"
      ],
      "kLevel": "K2",
      "type": "single",
      "selectCount": 1,
      "difficulty": 2,
      "hasMedia": false,
      "tags": [
        "test-activities",
        "test-analysis",
        "test-design"
      ],
      "languages": [
        "en",
        "tr"
      ],
      "syllabusVersion": "4.0.1",
      "status": "published"
    },
    {
      "id": "ctfl4-0017",
      "revision": 2,
      "chunk": "ch01-a",
      "chapter": 1,
      "section": "1.4",
      "objectives": [
        "FL-1.4.1"
      ],
      "kLevel": "K2",
      "type": "single",
      "selectCount": 1,
      "difficulty": 2,
      "hasMedia": false,
      "tags": [
        "test-activities",
        "test-completion"
      ],
      "languages": [
        "en",
        "tr"
      ],
      "syllabusVersion": "4.0.1",
      "status": "published"
    },
    {
      "id": "ctfl4-0018",
      "revision": 2,
      "chunk": "ch01-a",
      "chapter": 1,
      "section": "1.4",
      "objectives": [
        "FL-1.4.2"
      ],
      "kLevel": "K2",
      "type": "single",
      "selectCount": 1,
      "difficulty": 2,
      "hasMedia": false,
      "tags": [
        "context-factors"
      ],
      "languages": [
        "en",
        "tr"
      ],
      "syllabusVersion": "4.0.1",
      "status": "published"
    },
    {
      "id": "ctfl4-0019",
      "revision": 1,
      "chunk": "ch01-a",
      "chapter": 1,
      "section": "1.4",
      "objectives": [
        "FL-1.4.3"
      ],
      "kLevel": "K2",
      "type": "multi",
      "selectCount": 2,
      "difficulty": 3,
      "hasMedia": false,
      "tags": [
        "testware",
        "test-implementation",
        "multi"
      ],
      "languages": [
        "en",
        "tr"
      ],
      "syllabusVersion": "4.0.1",
      "status": "published"
    },
    {
      "id": "ctfl4-0020",
      "revision": 1,
      "chunk": "ch01-a",
      "chapter": 1,
      "section": "1.4",
      "objectives": [
        "FL-1.4.4"
      ],
      "kLevel": "K2",
      "type": "single",
      "selectCount": 1,
      "difficulty": 2,
      "hasMedia": false,
      "tags": [